{
  "schemaVersion": "1.0.0",
  "taskId": "example-codex-task",
  "status": "completed",
  "summary": "Implemented the bounded change and ran the requested check.",
  "changedFiles": ["src/example.mjs", "test/example.test.mjs"],
  "validations": [
    {
      "id": "focused-test",
      "status": "passed",
      "summary": "The focused test passed."
    }
  ],
  "residualRisks": [],
  "blocking": null
}
